{"$schema":"https://json-schema.org/draft/2020-12/schema","additionalProperties":false,"description":"Closed metadata-only receipt; semantic and hash checks are enforced by dpslab.official_source_receipt.","properties":{"capture":{"type":"object"},"identity":{"type":"object"},"integrity":{"type":"object"},"schema_version":{"const":"0.1"},"source":{"type":"object"}},"required":["schema_version","identity","source","capture","integrity"],"title":"DpsLab official source capture receipt 0.1","type":"object"}
