{"capture":{"byte_count":22,"capture_status":"captured_pending_review","complete":true,"content_sha256":"5be8790e8abd97a38ff67eefebc2bc3321a1d72d60d8139aa4c27a28284f2d03","etag":"\"s1\"","last_modified":null,"reused_previous":false,"transport_status":"response_quarantined_pending_capture_validation"},"identity":{"captured_at":"2026-08-01T20:00:00Z","receipt_id":"synthetic.receipt.001"},"integrity":{"hash_algorithm":"sha256","receipt_sha256":"1013a4e5dbb84f7b1740436a4f2f287ecd632d868655f3c72dc58ae35922339a"},"schema_version":"0.1","source":{"final_host":"worldofwarcraft.blizzard.com","media_type":"text/html","source_id":"blizzard.wow.content_update_notes"}}
